,date_created,username,verified_status,tweet_id,likes,views,replies,retweets,source,language,retweeted_id,quoted_id,text
201,2020-01-01 15:00:32+00:00,Louisiana_sos,True,1212388139102330880,3,,0,0,Hootsuite Inc.,en,,,Happy New Year! https://t.co/8dKzxblJl1
202,2020-01-01 19:27:34+00:00,MichSoS,True,1212455340979183616,4,,0,5,Twitter Web App,en,,,"Happy New Year! Resolve to get your REAL ID well in advance of the Oct. 1, 2020, deadline. https://t.co/TmpXVKj4BE https://t.co/oZsFp6KKxh"
203,2020-01-01 16:53:18+00:00,RepLaHood,True,1212416520095227904,7,,6,2,Twitter for iPhone,en,,,Happy New Year! I hope your 2020 is blessed with happiness and good health. 🎉 #HappyNewYear https://t.co/iWt4WgzRCN
204,2020-01-01 14:01:19+00:00,PAStateDept,True,1212373238598250497,1,,0,0,Hootsuite Inc.,en,,,We wish everyone a healthy and happy #NewYear. https://t.co/JS5SP6SZq8
205,2020-01-01 14:27:11+00:00,PADems,True,1212379748728528902,48,,3,8,Twitter for iPhone,en,,,"Happy New Year, Pennsylvania!

This is the year all our hard work comes together. This year, we elect a Democratic president, flip the state legislature, and begin a new era of progress for all Pennsylvanians.

2020 will be hard, but every year hereafter will be brighter for it."
206,2020-01-01 21:28:01+00:00,Allegheny_Co,False,1212485652375322628,1,,0,3,Twitter for iPhone,en,,,Hampton: 2100 block Wildwood Rd - Single vehicle rollover with a pole and wires down. Wildwood Rd. will be closed from S. Montour Rd to Au Sable Dr.
207,2020-01-01 15:01:41+00:00,Allegheny_Co,False,1212388430187057157,2,,0,0,Twitter for iPhone,en,,,"Pittsburgh: Vehicle crash - Inbound Armstrong Tunnel. Pittsburgh Police, Fire &amp; EMS are on scene. Traffic/utility box with wires also down."
208,2020-01-01 21:27:43+00:00,RepLouCorrea,True,1212485579105095682,24,,0,6,Tweetbot for Mac,en,,https://twitter.com/repjohnlewis/status/1211661167728480256,"We pray as a nation for @repjohnlewis. 

From the Edmund Pettus Bridge, to the steps of the Lincoln Memorial, to the halls of Congress, John has fought and overcome his entire life. 

We are with him as he battles this latest challenge—every step of the way."
209,2020-01-01 20:54:22+00:00,RepLouCorrea,True,1212477186873143296,9,,2,3,Tweetbot for Mac,en,,,"Happy New Year! Wishing health, happiness and prosperity to everyone. https://t.co/Za4wAh2Rc1"
210,2020-01-01 02:34:59+00:00,PolkElections1,False,1212200517130211328,2,,0,0,Twitter for Android,en,,,"Happy New Year!!! 

The Elections Office will be closed in observance of the New Year. See you on Thursday!

For 24/7 assistance visit https://t.co/ELUPS5dcbE. https://t.co/dH9JVbnGnR"
211,2020-01-01 19:03:07+00:00,VoteSeminole,True,1212449188937646080,5,,0,1,Twitter for iPhone,en,,,"2020 is going to be a huge year for us in the Elections Office!  We have 3 Elections coming up in March, August, and November. We will be closed today Wednesday Jan. 1st 2020. Normal business hours will resume on Thursday Jan. 2nd 2020. https://t.co/nww6DnehxA"
212,2020-01-01 18:43:41+00:00,VoteSeminole,True,1212444297049583619,1,,0,0,Twitter for iPhone,en,,,"True! Orlando is the top destination in the U.S. follow by Anaheim, California then Honolulu, Hawaii. Did you travel somewhere for New Years? If so, where? https://t.co/DB2jnkkCGy"
213,2020-01-01 04:59:34+00:00,VoteMarion,True,1212236902176350208,4,,0,1,Ripl App,en,,,Your Marion County Elections Team wishes you a bright and happy year!✨ Start the new year off right by making sure you're registered to vote and your registration is current. Visit https://t.co/hXQIlic0Y7. https://t.co/3dJvTDz4d1
214,2020-01-01 07:12:51+00:00,DenverElections,True,1212270443500953600,7,,1,2,Twitter for iPhone,en,,,Happy New Year from @DenverElections! 2020 is going to be a busy year and we look forward to providing the usual great voter experience! @MileHighClerk #DenverVotes2020 #COPolitics https://t.co/72Q61toxG3
215,2020-01-01 18:30:08+00:00,MDCElections,True,1212440888674267138,7,,0,2,Salesforce - Social Studio,en,,,Happy New Year from @MDCElections. Start off 2020 by registering to vote or updating your voter information today! https://t.co/no8R5WivnE #BeInformed #HappyNewYear https://t.co/xXB3mezMrD
216,2020-01-01 14:00:39+00:00,MDCElections,True,1212373070293458945,5,,0,2,Salesforce - Social Studio,en,,,Happy New Year to all of our wonderful #PollWorkers! We look forward to having you serve in the 2020 Miami-Dade County Elections. #BeAProudPollWorker in #OurCounty. #NewYearsResolutions https://t.co/qGAmBRlAxf
217,2020-01-01 13:00:08+00:00,MIOaklandClerk,False,1212357840284856320,0,,0,0,Twuffer,en,,,"#OnThisDay in 1863, President Lincoln issued the Emancipation Proclamation. https://t.co/LRDCf0tKqL"
218,2020-01-01 15:05:20+00:00,PhillyVotes,True,1212389348449980417,5,,0,0,Hootsuite Inc.,en,,,Happy New Year! Here’s to wishing you a great and successful 2020. https://t.co/AZA0AH6mKQ
219,2020-01-01 14:00:45+00:00,HarrisVotes,True,1212373096050634753,2,,0,0,Hootsuite Inc.,en,,,"We are closed today for the holiday, but we will re-open tomorrow. https://t.co/tDxswKLIPg"
220,2020-01-01 06:00:31+00:00,HarrisVotes,True,1212252242222469120,5,,0,0,Hootsuite Inc.,en,,,Wishing you all a Happy and Prosperous New Year!🎇 https://t.co/eF7hGSn8oG
221,2020-01-01 22:18:20+00:00,RepLoriTrahan,True,1212498317843861504,4,,1,4,Twitter for iPhone,en,,,"2019 was a year of many firsts for us. Working for #MA3 has been the greatest honor of my life, and I cannot wait to see what 2020 has in store. Take a look back at some of our most memorable moments from the past year 👉 https://t.co/yajwGBSsrl https://t.co/2xpAdQyBnd"
222,2020-01-01 22:12:57+00:00,RepLoriTrahan,True,1212496960751652864,1,,0,1,Twitter Web App,en,,,"High School students across our district &amp; nation are demanding a seat at the table because they want their concerns addressed. As @RepPressley said, “We are not here to take up space (in Congress); we’re here to create space.” We’re creating space for leaders of tomorrow!"
223,2020-01-01 22:12:56+00:00,RepLoriTrahan,True,1212496958297968640,4,,2,1,Twitter Web App,en,,,"Young people are our country’s most powerful asset. This month, @RepPressley and I joined our young people in #Lawrence to talk with them about the how to make their voices heard and become more civically engaged. https://t.co/vsIeFsqCHA"
224,2020-01-01 22:12:53+00:00,RepLoriTrahan,True,1212496946612592647,3,,1,1,Twitter Web App,en,,,"As we welcome the #NewYear, we have been looking back on #2019inMA3 – and thinking of our top priorities to make our communities the strongest they can be."
225,2020-01-01 17:58:31+00:00,RepLoriTrahan,True,1212432932746473472,4,,0,1,Twitter for iPhone,en,,,"I am proud of the work we’ve done over the past 12 months — all of which directly impacts our community. As we enter 2020, we are more energized than ever to get to work for #MA3! https://t.co/1oNFNmqqF0"
226,2020-01-01 17:57:15+00:00,RepLoriTrahan,True,1212432614117838848,13,,0,1,Twitter for iPhone,en,,,"Starting 2020 off the right way! I am thankful everyday for all those brave first responders who step up to serve our communities and keep us safe. 
https://t.co/Huyw4EE5ky"
227,2020-01-01 14:15:00+00:00,RepHaleyStevens,True,1212376680834256899,36,,8,2,TweetDeck,en,,,Happy New Year! Looking forward to another amazing year serving Michigan’s 11th District. https://t.co/9CsrCivyAy
228,2020-01-01 15:30:43+00:00,VoteHamCoBOE,True,1212395735850921984,2,,0,3,Hootsuite Inc.,en,,,NOW accepting Absentee Applications for voting by mail for all elections in 2020. Click link for more information https://t.co/d7sVsKemh6. A separate application is required for each election https://t.co/7my9Y4OCsy
229,2020-01-01 12:30:35+00:00,VoteHamCoBOE,True,1212350403880325121,0,,0,0,Hootsuite Inc.,en,,,"Board of Elections offices will be closed TODAY, Jan 1 to observe New Year’s Day https://t.co/ynjvkzNJrp"
230,2020-01-01 23:00:00+00:00,RepSusieLee,True,1212508803188568070,19,,4,3,TweetDeck,en,,,Happy last day of Kwanzaa to all those celebrating! I hope the holiday brought fulfillment and joy to you and your family.
231,2020-01-01 07:00:00+00:00,RepSusieLee,True,1212267211773091840,78,,11,8,TweetDeck,en,,,"One year ago, I was sent to Congress by my constituents for one reason: fight #ForThePeople. With over 400 passed bills, dozens of hearings and countless calls with constituents—we going to keep up our fight in 2020. #HappyNewYear #NV03! https://t.co/YqvCvxZUDV"
232,2020-01-01 04:00:00+00:00,RepSusieLee,True,1212221911847096325,56,,5,6,TweetDeck,en,,,Still can’t believe my 2019 started off like this. I’m so humbled by the opportunity to serve #NV03 in Congress. I promise I’ll keep working just as hard in 2020. https://t.co/eQOjKizFmM
233,2020-01-01 00:00:00+00:00,RepSusieLee,True,1212161514465091586,1,,0,2,TweetDeck,en,,,"Stop by #TeamLee’s upcoming mobile office hours on Saturday, January 18th at the Sandy Valley Senior Center! 
https://t.co/AT6Z26HbTl"
234,2020-01-01 16:54:34+00:00,RepTimmons,True,1212416839722131457,13,,3,1,Twitter for iPhone,en,,,"Happy New Year! During the busy holiday season, I enjoy making time to reflect on things I am grateful for including my family, our community, and the opportunity to represent you in Congress. 

It is an honor to serve you. https://t.co/lWGGze6hm8"
235,2020-01-01 15:00:00+00:00,RepCarolMiller,True,1212388005802962944,17,,3,1,TweetDeck,en,,,"Happy New Year! I am excited to continue our work in this new year, and decade, to make #WV03 an even better place to live, work, and raise a family!"
236,2020-01-01 17:52:25+00:00,FCVOTES,False,1212431396335214597,0,,0,0,IFTTT,en,,,"RT NCSBE ""Happy New Year from the State Board of Elections! We're here to help with your voting-related resolutions:

Register to vote: https://t.co/Vkok0nArvX
Check your registration: https://t.co/nt0gTeSE99
Get Involved: https://t.co/KBnzRSTkB5 https://t.co/qsBa6P4Z8g"""
237,2020-01-01 14:11:59+00:00,SenHawleyPress,True,1212375924496326658,41,,10,5,Twitter Media Studio,en,,,An incredible year of accomplishments. And he’s just getting started. #HappyNewYear https://t.co/xEUz1Snvuf
238,2020-01-01 16:07:34+00:00,DougBurgum,True,1212405008358088704,73,,2,4,Twitter Web App,en,,,Happy New Year! Wishing you a 2020 filled with gratitude and curiosity! https://t.co/64ADVaTY88
239,2020-01-01 06:01:27+00:00,DougForDakota,True,1212252477535465472,21,,0,5,CoSchedule,en,,,"Happy New Year, North Dakota! https://t.co/A6KaogPRRw"
240,2020-01-01 02:42:45+00:00,GovChrisSununu,True,1212202472137273344,223,,25,42,Twitter for iPhone,en,,,"In just a few hours, the Merrimack tolls will no longer exist — we are zeroing out the Merrimack tolls tonight once and for all. It’s the right thing to do. #HappyNewDecade https://t.co/LeRscMtcq0"
241,2020-01-01 17:31:08+00:00,Sheila4Congress,False,1212426040762654727,2,,0,0,Hootsuite Inc.,en,,https://twitter.com/erniefay/status/1209350872162979841,Happy New Year &amp; thank you for this! I'm grateful to help protect America's families. https://t.co/eoufqQ4He4
242,2020-01-01 10:25:05+00:00,Sheila4Congress,False,1212318820381138944,4,,0,2,Hootsuite Inc.,en,,,"Happy New Year!!! 
Wishing you a happy, healthy, peaceful and prosperous New Year! May you fearlessly create the life you want by chasing the life you seek. 

#SheilaforCongress https://t.co/rUGcXQmyuc"
243,2020-01-01 05:00:58+00:00,Sheila4Congress,False,1212237254019690496,2,,0,2,Hootsuite Inc.,en,,,Happy New Year!!!! https://t.co/d9unxL9KYM
244,2020-01-01 06:00:00+00:00,mikeparson,True,1212252110651371520,39,,1,8,TweetDeck,en,,,Happy New Year from Teresa and me. Our state saw historic growth in 2019 and we are going to work hard to keep it going in 2020! https://t.co/ElSp05GzOA
245,2020-01-01 17:58:32+00:00,GovParsonMO,True,1212432936382980096,101,,40,31,Twitter for iPhone,en,,,"From economic and workforce development to rebuilding our state’s infrastructure, 2019 was an exciting year for Missouri.

We look forward to building upon these successes and moving #MissouriForward in the new year. https://t.co/YgWukWwoeA"
246,2020-01-01 14:29:23+00:00,Surgeon_General,True,1212380303156748288,57,,5,32,Twitter for iPhone,en,,,#HappyNewYear2020! Looking for a resolution? Here are 2️⃣ - #GetNaloxone and learn how to use it! Naloxone can literally mean the difference between life and death. Learn more: https://t.co/8XvGfeLtQF #WednesdayWisdom
247,2020-01-01 05:16:20+00:00,Surgeon_General,True,1212241123290288129,179,,8,25,Twitter for iPhone,en,,,Have a happy and healthy 2020 everyone!
248,2020-01-01 19:43:03+00:00,TomTiffanyWI,True,1212459238259380231,7,,0,1,Twitter for Android,en,,,Today was the Northwoods youth deer hunt challenge banquet. 400 people in attendance including the next generation of sportsmen and women. Kudos to the organizers including the Minocqua Lions club. https://t.co/Eo9NJUbysN
249,2020-01-01 15:40:37+00:00,AugustPfluger,True,1212398227414224902,14,,0,2,Twitter Web App,en,,,"In 2019, I have been blessed to meet and talk with so many wonderful people around our #TX11 community and in 2020, I look forward to earning your vote to represent you in Congress! https://t.co/oBfgFQDmIs"
250,2020-01-01 17:51:30+00:00,JamaalBowmanNY,True,1212431166298624000,82,,0,11,Twitter for iPhone,en,,,Happy new year everyone! https://t.co/QWeX5oL2kk
251,2020-01-01 04:07:47+00:00,JamaalBowmanNY,True,1212223871547592704,28,,1,10,Twitter Web App,en,,,"We have just one hour until our deadline at midnight.

We need just $812 to reach our goal. 

Tonight, I’m asking you to join this people-powered movement by giving what you are able to now. Can I count on you to make your contribution towards our goals?
https://t.co/z8Y2UScNIP"
252,2020-01-01 01:42:03+00:00,JamaalBowmanNY,True,1212187195714539520,16,,1,3,Twitter for iPhone,en,,,"We only have a few hours left until our filing deadline!

Can you give just $6 before midnight to help us reach our goal?
https://t.co/EnxtDErSGH"
253,2020-01-01 01:30:10+00:00,JamaalBowmanNY,True,1212184204714356736,0,,0,0,Twitter for iPhone,en,,,@nikhilgoya_l Honored to have your brilliance support this policy platform. Now let’s make it a reality.
254,2020-01-01 00:38:21+00:00,JamaalBowmanNY,True,1212171167240531974,14,,0,3,Twitter for iPhone,en,,,"A huge victory for @MaketheRoadNY and many others for their grassroots efforts on behalf of those in the most vulnerable industries. 

This should be a federal policy along with a national $15.00 minimum wage. 

https://t.co/cM8hmXxVOI"
255,2020-01-01 01:30:08+00:00,TransportDems,True,1212184195218464768,4,,2,1,Twitter for iPhone,en,,,"2019 was a busy and productive year for the Committee’s work #ForThePeople. We held 47 hearings, 5 roundtables, 7 markups, heard from 294 witnesses, and passed 27 bills through the House! Happy New Year!"
256,2020-01-01 19:13:20+00:00,CAgovernor,True,1212451761560027136,63,,9,50,Twitter Media Studio,en,,,"It's January 1 and that means many new California laws take effect today! 

Here are some that you need to know about. 🎥⏯ https://t.co/MbQelYZZwA"
257,2020-01-01 01:32:27+00:00,CAgovernor,True,1212184778503413760,5,,1,1,Twitter for iPhone,en,,,"Child care providers help California’s economy by allowing working families &amp; parents to work!
This year, @GavinNewsom signed @AsmMoniqueLimon’s #AB378 to give child care workers the right to join a union and collectively bargain with the state. #CaliforniaForAll https://t.co/sqB1b5Rbjr"
258,2020-01-01 01:24:14+00:00,CAgovernor,True,1212182710208233473,10,,3,1,Twitter for iPhone,en,,,"Not only did the 2019-20 #CaliforniaForAll budget invest historic amounts in Californians, it also eliminated CA’s wall of debt while saving for a rainy day causing a major credit agency to upgrade California’s credit score. https://t.co/EeKv7ifOgs"
259,2020-01-01 01:22:04+00:00,CAgovernor,True,1212182166064398341,10,,2,1,Twitter for iPhone,en,,,"Approximately 1 million Californians are without safe drinking water.

In July of 2019, the Safe and Affordable Drinking Water Fund was established to help local water systems provide safe drinking water to communities without it. #CaliforniaForAll https://t.co/bb9QKRKZ5K"
260,2020-01-01 21:33:15+00:00,GavinNewsom,True,1212486971039178752,5028,,4197,529,Twitter for iPhone,en,,,"Happy New Year! What an incredible decade. We’ve accomplished so much in CA by standing up for our values and taking on some of the biggest issues -- from healthcare to gun violence to climate change. 

Let’s keep it going. 

Here’s to 2020 and the decade ahead!!"
261,2020-01-01 01:37:39+00:00,GovLauraKelly,True,1212186087466176514,15,,5,1,Twitter for iPhone,en,,,We increased funding for higher education and challenged our Regents universities to ensure that funding protects Kansas college students from a tuition hike for the first time in years. #GovKellyRecap2019 https://t.co/l2kYfL9vZy
262,2020-01-01 01:19:34+00:00,GovLauraKelly,True,1212181537883602945,14,,2,2,Twitter for iPhone,en,,,"In conjunction with @SecretaryToland, we established @kansasgrowth – a comprehensive strategy for economic growth in the state. A team of stakeholders, business leaders and economic development professionals will implement three phases for economic growth. #GovKellyRecap2019 https://t.co/UUnhUWpB7A"
263,2020-01-01 00:52:49+00:00,GovLauraKelly,True,1212174806109630464,25,,3,7,Twitter for iPhone,en,,,"In 2019 I appointed @LtGovRogers to lead the newly-established Office of Rural Prosperity, which is developing statewide policies and initiatives for improving life in rural communities that have been neglected for far too long. #GovKelly2019Recap https://t.co/HH5bmcEgLN"
264,2020-01-01 00:26:27+00:00,GovLauraKelly,True,1212168169642774528,17,,2,2,Twitter for iPhone,en,,,"Current labor market data for November 2019, shows that - for the second month in a row - Kansas maintained its lowest rate of unemployment in 40 years at 3.1%. Over the past year, Kansas also experienced job creation and positive wage growth. #GovKelly2019Recap https://t.co/cuBRu64gjL"
265,2020-01-01 14:00:01+00:00,HouseGOP,True,1212372909211013120,539,,54,78,TweetDeck,en,,,Wishing you and your family a #HappyNewYear! https://t.co/VAsR0hoRkD
266,2020-01-01 14:04:39+00:00,AaronPBean,True,1212374076028645377,18,,1,0,Twitter for iPhone,en,,,"Happy New Year! I hope 2020 brings you joy, contentment, and prosperity! https://t.co/4X2eWGXSph"
267,2020-01-01 13:49:52+00:00,Adrian_Fontes,True,1212370355274174466,5,,2,0,Twitter for iPhone,en,,,They say people go crazy with new year resolutions...why am I the only one at the gym?
268,2020-01-01 12:45:01+00:00,Adrian_Fontes,True,1212354035174428672,40,,1,10,Twitter for iPhone,en,,,"This year marks 100 years of suffrage for women.
Are you encouraging all your friends and relatives to register and vote?
#ProtectDemocracy"
269,2020-01-01 12:43:30+00:00,Adrian_Fontes,True,1212353657104027648,1,,0,0,Twitter for iPhone,en,,https://twitter.com/PHXRisingFC/status/1212267209868894208,"More @PHXRisingFC !!
Can we top 2019?!? I’m betting that it will be a heck of a run trying!!
#Rising2020"
270,2020-01-01 12:41:51+00:00,Adrian_Fontes,True,1212353240311795712,3,,0,0,Twitter for iPhone,en,,,"@SJDoerr @PHXRisingFC The way @AZSports celebrates great performances tells me never to go to one of their happy hours.
#lame"
271,2020-01-01 12:38:59+00:00,Adrian_Fontes,True,1212352517771677696,1,,0,0,Twitter for iPhone,en,,https://twitter.com/AZSports/status/1212236507110526977,"Super lame to leave THE greatest performance of the year off your list.
Do better.
@PHXRisingFC"
272,2020-01-01 12:23:20+00:00,Adrian_Fontes,True,1212348580494626816,1,,0,0,Twitter for iPhone,en,,https://twitter.com/AmberMcReynolds/status/1212347660520148993,"I can’t wait to watch this today!!
Go @AmberMcReynolds !!!
#ProtectDemocracy"
273,2020-01-01 01:45:51+00:00,Adrian_Fontes,True,1212188150702850048,2,,0,0,Twitter for iPhone,en,,https://twitter.com/PHXRisingFC/status/1212101117196296192,"The super sentimental tweets from this club are well warranted.
Catch a game next season! Support this amazing franchise!"
274,2020-01-01 01:37:10+00:00,Adrian_Fontes,True,1212185968653979649,50,,2,4,Twitter for iPhone,en,,,"I’m up to 3,410 followers because both of my teenage neighbors just decided to get onboard.
And the 18yo is registered but didn’t get on the perm early vote list...so we’re fixing that.
Neighbors helping neighbors to #ProtectDemocracy"
275,2020-01-01 01:23:52+00:00,Adrian_Fontes,True,1212182618034229248,5,,1,0,Twitter for iPhone,en,,https://twitter.com/BandidosPHX/status/1212165186460585984,I love these guys...
276,2020-01-01 05:05:13+00:00,BrookeELierman,True,1212238326171914240,20,,0,1,Hootsuite Inc.,en,,,Happy New Year and New Decade! https://t.co/stesvio6k1
277,2020-01-01 20:50:09+00:00,ERICSORENSEN,True,1212476124816695296,0,,0,0,Twitter for iPhone,und,,,@AustinMacD73 Ehhhhhh
278,2020-01-01 19:19:39+00:00,ERICSORENSEN,True,1212453350068965376,33,,12,4,Twitter for iPhone,en,,,"I’m not coming back on social media until everyone’s done with the Barbara Walters stuff. 

She’s got dementia and hasn’t been seen publicly in a few years. We should be thinking of her health and well-being."
279,2020-01-01 06:55:55+00:00,ERICSORENSEN,True,1212266181618552837,1,,1,0,Twitter for iPhone,en,,,@proughwx @CurtisParkview @ABC21WPTA @KaitlynReports That is not you.
280,2020-01-01 06:55:36+00:00,ERICSORENSEN,True,1212266104405610496,2,,1,0,Twitter for iPhone,en,,,@blaisekellerr That is not you.
281,2020-01-01 06:27:07+00:00,ERICSORENSEN,True,1212258935190773760,1,,1,0,Twitter for iPhone,en,,,"@DaveHerrell Dave, you belong in QC Hall of Fame! Here’s to a great new decade. Glad you’re here!"
282,2020-01-01 04:26:04+00:00,ERICSORENSEN,True,1212228470098583553,48,,2,2,Twitter for iPhone,en,,,"My last tweet of the decade? 

Boobytrap backwards is partyboob."
283,2020-01-01 16:09:03+00:00,COSecofState,True,1212405383328927747,3,,0,1,Sprout Social,en,,,"Happy New Year!  Just a reminder our offices are closed today but all of our services remain available online: https://t.co/lVkJQnzttf.  We'll be back open on Thursday, January 2. https://t.co/VPL9wWsFDc"
284,2020-01-01 23:11:59+00:00,PatRyanUC,True,1212511819471962112,9,,0,1,Twitter for iPhone,en,,,"An inspiring start to #2020 - witnessing two phenomenal public servants take their oaths of office. Huge congrats to @marchgallagher and @onekingston...look forward to rolling up our sleeves and getting to work together!!

And big thanks to @NYSComptroller for joining &amp; speaking! https://t.co/mxyZKgjTpk"
285,2020-01-01 23:43:26+00:00,ANTHONYDESPO,True,1212519732664061952,19,,4,7,Twitter Web App,en,,,"“Anyone who agrees that this law will endanger public safety &amp; the victims &amp; witnesses of crime should let @NYGovCuomo &amp; @NYSenDems &amp; @NYSA_Majority know before it’s too late &amp; innocent people get hurt,” @StatenIslandDA.  Welcome to 2020 - year of the perp
https://t.co/ObzBOs5c31"
286,2020-01-01 18:50:30+00:00,ANTHONYDESPO,True,1212446013153263616,7,,0,2,Twitter Web App,en,,,"Once again teaming up w/ my family in blue to host @leoweekend event on 2/29 at Junction LBNY.

@leoweekend work throughout the year to support families affected by a line of duty death or serious injury &amp; are front and center whenever #lawenforcement needs help.  

Come on down! https://t.co/XSXg5KmLkI"
287,2020-01-01 17:51:04+00:00,ANTHONYDESPO,True,1212431057926184962,10,,0,2,Twitter Web App,en,,,"#HappyNewYear!

@HempsteadTown Sanitation schedules will be going out soon, but you can use these to print and keep on the fridge.

Also, check out dates for our S.T.O.P. program &amp; thx @CSEALocal880! https://t.co/5QJhJvMcSF"
288,2020-01-01 16:23:44+00:00,ANTHONYDESPO,True,1212409080624623621,12,,0,4,Twitter Web App,en,,,"Message is simple: this isn't a Jewish issue, a Catholic issue, a black/white issue, a hispanic/asian issue - this is an American issue. Stood w/@TOHClavin @dorothylgoosby @MissyMillerNY20 &amp; @HempsteadTown religious leaders, together to fight hate/bigotry &amp; decry recent attacks https://t.co/0oFRdqxhAh"
289,2020-01-01 00:29:24+00:00,ANTHONYDESPO,True,1212168911971635202,10,,0,3,Twitter for iPhone,en,,,Official: 'We will not tolerate' hate crimes Hempstead Town Supervisor-elect Donald X. Clavin Jr. spoke Tuesday at the Yeshiva of South Shore in Hewlett to denounce the ... https://t.co/KvUAd07cMe
290,2020-01-01 19:26:21+00:00,KevinKileyCA,True,1212455035000352768,3,,0,1,Twitter Web App,en,,,"The Chief Justice is right that “civic education has fallen by the wayside.” I’ve introduced legislation to enhance civics education in CA high schools and colleges.

https://t.co/Iy2lpHCopi"
291,2020-01-01 18:56:23+00:00,KevinKileyCA,True,1212447496040898561,17,,0,8,Twitter Web App,en,,https://twitter.com/TerenceHyland/status/1212365931734818816,"Notably, the judge’s order found that enforcing #AB5 would cause irreparable harm, and that blocking it is in the public interest."
292,2020-01-01 05:06:06+00:00,DonDavisNC,True,1212238546469302272,8,,1,1,Twitter for iPhone,en,,,Happy New Year! Wishing you a magnificent 2020.
293,2020-01-01 19:28:28+00:00,JocelynBenson,True,1212455569233190915,11,,1,2,Twitter for iPhone,art,,https://twitter.com/MichSoS/status/1212455340979183616,⤵️⤵️⤵️
294,2020-01-01 02:22:15+00:00,SethMagaziner,True,1212197312635834368,12,,0,2,Twitter for iPhone,en,,,"2019 was productive. We helped a lot of people, and left Rhode Island better than we found it.

But there is so much more to do.The progress continues in the new year!
10/10 https://t.co/7ZqU3DUEzF"
